{
  "$schema": "https://json-schema.org/draft/2020-12/schema",
  "$id": "https://github.com/bvrtu/erroratlas/raw/main/data/schemas/benchmark-summary-v1.schema.json",
  "title": "ErrorAtlas benchmark summary artifact v1",
  "type": "object",
  "additionalProperties": false,
  "required": [
    "schemaVersion",
    "datasetVersion",
    "generatedAt",
    "sourceDataset",
    "summary"
  ],
  "properties": {
    "schemaVersion": {
      "const": 1
    },
    "datasetVersion": {
      "type": "string",
      "pattern": "^\\d{4}\\.\\d{2}\\.\\d{2}\\.\\d+$"
    },
    "generatedAt": {
      "type": "string",
      "pattern": "^\\d{4}-\\d{2}-\\d{2}T\\d{2}:\\d{2}:\\d{2}(?:\\.\\d+)?Z$"
    },
    "sourceDataset": {
      "type": "string",
      "pattern": "^data/external-benchmark-v\\d+\\.json$"
    },
    "summary": {
      "$ref": "benchmark-v4.schema.json#/$defs/summary"
    }
  }
}
